{
  "$schema": "http://json-schema.org/draft-07/schema#",
  "$id": "https://gi-harness/godotworld/spec.schema.json",
  "title": "Godot game-spec v1",
  "description": "Declarative, engine-neutral-in-spirit game specification interpreted by the FROZEN godotworld/runner.gd. The LLM emits DATA only; no GDScript ever runs from a spec. See godotworld/SPEC.md.",
  "type": "object",
  "required": ["meta", "bodies", "act", "predicates"],
  "additionalProperties": true,
  "properties": {
    "engine": {
      "description": "Optional engine marker. When present must be \"godot\"; the harness also routes any *.spec.json path to this lane.",
      "const": "godot"
    },
    "spec_version": {"type": "integer", "enum": [1, 2]},
    "world": {
      "type": "object",
      "description": "Optional world-level physics mode (SPEC.md §2b). Omitted -> side view (gravity (0,-900), zero damping; byte-identical back-compat).",
      "additionalProperties": false,
      "properties": {
        "view": {
          "enum": ["side", "topdown"],
          "description": "side (default): gravity (0,-900), a platformer/tower/pit seen from the side. topdown: gravity (0,0), the x/y plane is the floor seen from above; bodies glide and linear_damp is the friction analog."
        },
        "linear_damp": {
          "type": "number",
          "minimum": 0,
          "description": "topdown only: the per-body linear damping (top-down friction analog) applied to every dynamic body so a released body coasts to a stop. Omitted -> 1.5. Ignored in side view."
        }
      }
    },
    "meta": {
      "type": "object",
      "required": ["title", "prompt", "actions"],
      "additionalProperties": true,
      "properties": {
        "title": {"type": "string", "minLength": 1},
        "prompt": {"type": "string"},
        "world_size": {
          "type": "array",
          "items": {"type": "number"},
          "minItems": 2,
          "maxItems": 2,
          "description": "Optional [w, h]; width 800..2400, height 600..1600 (G0 validates). Omitted -> [800, 600]."
        },
        "actions": {
          "type": "array",
          "items": {"type": "string", "minLength": 1},
          "minItems": 2,
          "maxItems": 8,
          "description": "2..8 game-chosen action names."
        }
      }
    },
    "bodies": {
      "type": "array",
      "minItems": 2,
      "items": {"$ref": "#/definitions/body"}
    },
    "joints": {
      "type": "array",
      "items": {"$ref": "#/definitions/joint"}
    },
    "on_contact": {
      "type": "array",
      "items": {"$ref": "#/definitions/contact_rule"}
    },
    "sensors": {
      "type": "array",
      "description": "spec-v2: optional raycast obs sensors attached under a named body; each get_observation() is appended to the runner's per-tick obs tail. See SPEC.md.",
      "items": {"$ref": "#/definitions/sensor"}
    },
    "act": {
      "type": "object",
      "description": "Per-action list of verb calls. Keys should be a subset of meta.actions; an action with no binding (or [] ) is a no-op (and will fail G1 efficacy).",
      "additionalProperties": {
        "type": "array",
        "items": {"$ref": "#/definitions/verb_call"}
      }
    },
    "on_step": {
      "type": "array",
      "items": {"$ref": "#/definitions/behavior"}
    },
    "predicates": {
      "type": "object",
      "required": ["success", "checkpoints"],
      "additionalProperties": false,
      "properties": {
        "success": {"$ref": "#/definitions/predicate"},
        "failure": {"$ref": "#/definitions/predicate"},
        "checkpoints": {
          "type": "object",
          "minProperties": 1,
          "maxProperties": 6,
          "description": "1..6 ordered milestone expressions (insertion order = intended progression). Keys are snake_case; every expression must be a bool that is False at t=0.",
          "additionalProperties": {"$ref": "#/definitions/predicate"}
        }
      }
    }
  },
  "definitions": {
    "body": {
      "type": "object",
      "required": ["name", "shape", "pos"],
      "additionalProperties": false,
      "properties": {
        "name": {"type": "string", "minLength": 1},
        "shape": {"enum": ["box", "circle", "segment", "poly"]},
        "pos": {"$ref": "#/definitions/vec2"},
        "size": {"$ref": "#/definitions/vec2", "description": "box only: [w, h]"},
        "radius": {"type": "number", "exclusiveMinimum": 0, "description": "circle only"},
        "a": {"$ref": "#/definitions/vec2", "description": "segment only: endpoint A (local)"},
        "b": {"$ref": "#/definitions/vec2", "description": "segment only: endpoint B (local)"},
        "vertices": {
          "type": "array",
          "minItems": 3,
          "items": {"$ref": "#/definitions/vec2"},
          "description": "poly only: local convex vertices"
        },
        "mass": {"type": "number", "exclusiveMinimum": 0},
        "static": {"type": "boolean"},
        "sensor": {"type": "boolean", "description": "non-colliding overlap zone (realised as Area2D)"},
        "friction": {"type": "number", "minimum": 0},
        "elasticity": {"type": "number", "minimum": 0},
        "locked_rotation": {"type": "boolean"},
        "angle": {"type": "number", "description": "initial rotation (radians)"},
        "velocity": {"$ref": "#/definitions/vec2", "description": "initial linear velocity"},
        "control": {"type": "boolean", "description": "exactly one dynamic body must set this true"}
      }
    },
    "joint": {
      "type": "object",
      "required": ["type", "a", "b"],
      "additionalProperties": false,
      "properties": {
        "type": {"enum": ["pin", "pivot", "spring"]},
        "a": {"type": "string"},
        "b": {"type": "string"},
        "point": {"$ref": "#/definitions/vec2", "description": "pivot: world anchor point"},
        "anchor_a": {"$ref": "#/definitions/vec2"},
        "anchor_b": {"$ref": "#/definitions/vec2"},
        "rest_length": {"type": "number", "description": "spring only"},
        "stiffness": {"type": "number", "description": "spring only"},
        "damping": {"type": "number", "description": "spring only"}
      }
    },
    "sensor": {
      "type": "object",
      "description": "spec-v2 raycast obs sensor. A fan of n_rays RayCast2D over cone_width_deg, attached under `attach_to`; each ray returns a normalized proximity in [0,1] (0 = no hit, ->1 as the hit nears).",
      "required": ["type", "attach_to"],
      "additionalProperties": false,
      "properties": {
        "type": {"enum": ["raycast2d"]},
        "attach_to": {"type": "string", "minLength": 1, "description": "name of the body the sensor rides on"},
        "n_rays": {"type": "integer", "minimum": 1, "maximum": 64, "description": "ray count (obs length); default 16"},
        "ray_length": {"type": "number", "exclusiveMinimum": 0, "description": "max ray reach in px; default 200"},
        "cone_width_deg": {"type": "number", "exclusiveMinimum": 0, "maximum": 360, "description": "fan spread in degrees; default 360"},
        "collision_mask": {"type": "integer", "minimum": 0, "description": "2D physics layers the rays hit; default 1"}
      }
    },
    "contact_rule": {
      "type": "object",
      "required": ["a", "b", "flag"],
      "additionalProperties": false,
      "properties": {
        "a": {"type": "string"},
        "b": {"type": "string"},
        "flag": {"type": "string", "minLength": 1},
        "once": {"type": "boolean", "default": true}
      }
    },
    "verb_call": {
      "type": "object",
      "required": ["verb", "body"],
      "additionalProperties": false,
      "properties": {
        "verb": {"enum": ["impulse", "force", "set_velocity", "torque", "thrust"]},
        "body": {"type": "string"},
        "vec": {"$ref": "#/definitions/vec2", "description": "impulse/force/set_velocity: the [x, y] vector"},
        "magnitude": {"type": "number", "description": "torque/thrust: signed scalar. torque -> apply_torque_impulse(magnitude); thrust -> impulse of (magnitude, 0) rotated by the body's current heading"},
        "when": {"$ref": "#/definitions/predicate", "description": "optional gate; the verb applies only when this predicate is true"}
      }
    },
    "behavior": {
      "type": "object",
      "required": ["kind"],
      "oneOf": [
        {
          "properties": {
            "kind": {"const": "velocity_clamp"},
            "body": {"type": "string"},
            "vx_max": {"type": "number"},
            "vy_min": {"type": "number"},
            "vy_max": {"type": "number"}
          },
          "required": ["kind", "body"],
          "additionalProperties": false
        },
        {
          "properties": {
            "kind": {"const": "timer_flag"},
            "flag": {"type": "string"},
            "after_steps": {"type": "integer", "minimum": 0}
          },
          "required": ["kind", "flag", "after_steps"],
          "additionalProperties": false
        },
        {
          "properties": {
            "kind": {"const": "remove_when"},
            "flag": {"type": "string"},
            "body": {"type": "string"}
          },
          "required": ["kind", "flag", "body"],
          "additionalProperties": false
        },
        {
          "properties": {
            "kind": {"const": "rising_level"},
            "flag": {"type": "string"},
            "rate": {"type": "number"},
            "start": {"type": "number"}
          },
          "required": ["kind", "flag", "rate"],
          "additionalProperties": false
        }
      ]
    },
    "predicate": {
      "type": "string",
      "description": "A whitelisted expression over the query DSL (pos_x/pos_y/vel_x/vel_y/speed/angle/grounded/contacts/dist/flag + steps + abs/min/max/clamp/sqrt/floor/ceil + and/or/not). No attribute access, no arbitrary identifiers. See SPEC.md."
    },
    "vec2": {
      "type": "array",
      "items": {"type": "number"},
      "minItems": 2,
      "maxItems": 2
    }
  }
}
